{
  "$schema": "http://json-schema.org/draft-07/schema#",
  "title": "ISA Account",
  "type": "object",
  "properties": {
    "owner": { "type": "string" },
    "account_type": { "const": "ISA" },
    "currency": { "type": "string", "default": "GBP" },
    "last_updated": { "type": "string", "format": "date" },
    "holdings": {
      "type": "array",
      "items": {
        "type": "object",
        "required": ["ticker", "units", "acquired_date", "cost_basis_gbp"],
        "properties": {
          "ticker": { "type": "string" },
          "name": { "type": "string" },
          "units": { "type": "number" },
          "acquired_date": { "type": "string", "format": "date" },
          "cost_basis_gbp": { "type": "number" }
        }
      }
    }
  },
  "required": ["owner", "account_type", "holdings"]
}