{
  "owner": "alex",
  "account_type": "ISA",
  "currency": "GBP",
  "last_updated": "2025-07-15",
  "holdings": [
    {
      "ticker": "HFEL.L",
      "name": "Henderson Far East Income Ltd Ordinary NPV",
      "units": 902,
      "acquired_date": "2025-07-15",
      "cost_basis_gbp": 1997.93
    },
    {
      "ticker": "IEFV.L",
      "name": "iShares IV MSCI Europe Value Factor UCITS ETF Acc",
      "units": 636,
      "acquired_date": "2025-07-15",
      "cost_basis_gbp": 4997.10
    },
    {
      "ticker": "ERNS.L",
      "name": "iShares IV GBP Ultrashort Bond UCITS ETF GBP Dist",
      "units": 225,
      "acquired_date": "2025-07-15",
      "cost_basis_gbp": 23124.82
    },
    {
      "ticker": "MINV.L",
      "name": "iShares MSCI World Minimum Volatility UCITS ETF Acc",
      "units": 37,
      "acquired_date": "2025-07-15",
      "cost_basis_gbp": 1974.99
    },
    {
      "ticker": "CUKS.L",
      "name": "iShares MSCI UK Small CAP UCITS ETF",
      "units": 8,
      "acquired_date": "2025-07-15",
      "cost_basis_gbp": 2001.90
    },
    {
      "ticker": "JEGI.L",
      "name": "JPMorgan European Growth & Income plc ORD GBP0.005",
      "units": 4101,
      "acquired_date": "2025-07-15",
      "cost_basis_gbp": 4999.38
    },
    {
      "ticker": "SERE.L",
      "name": "Schroder European Real Estate Investment Trust plc Ord 10p",
      "units": 4409,
      "acquired_date": "2025-07-15",
      "cost_basis_gbp": 2999.77
    }
  ]
}
